{
   "id": "frr_bb_02",
   "name": "Faster Road Racing: Base Building Schedule 2",
   "description": "\"Base Training 2: Building up to 45 Miles (72 km) per Week\" from \"Faster Road Racing: 5K to Half Marathon\" by Pete D. Pfitzinger and Philip Latter.\"",
   "units": "mi",
   "source": "https://www.amazon.com/Faster-Road-Racing-Half-Marathon/dp/1450470459",
   "type": "Base",
   "schedule": [
      {
         "workouts": [
            {
               "title": "Rest or cross-training"
            },
            {
               "title": "General aerobic\n{6:10}",
               "distance": 6.0
            },
            {
               "title": "General aerobic\n{3:5}",
               "distance": 3.0
            },
            {
               "title": "General aerobic\n{4:6}",
               "distance": 4.0
            },
            {
               "title": "Rest or cross-training"
            },
            {
               "title": "General aerobic\n{5:9}",
               "distance": 5.0
            },
            {
               "title": "Endurance\n{9:14}",
               "distance": 9.0
            }
         ]
      },
      {
         "workouts": [
            {
               "title": "Rest or cross-training"
            },
            {
               "title": "General aerobic\n{6:10}",
               "distance": 6.0
            },
            {
               "title": "General aerobic\n{3:5}",
               "distance": 3.0
            },
            {
               "title": "General aerobic\n{5:8}",
               "distance": 5.0
            },
            {
               "title": "Rest or cross-training"
            },
            {
               "title": "General aerobic\n{6:10}",
               "distance": 6.0
            },
            {
               "title": "Endurance\n{10:16}",
               "distance": 10.0
            }
         ]
      },
      {
         "workouts": [
            {
               "title": "Rest or cross-training"
            },
            {
               "title": "General aerobic\n{6:10}",
               "distance": 6.0
            },
            {
               "title": "General aerobic\n{3:5}",
               "distance": 3.0
            },
            {
               "title": "General aerobic\n{5:8}",
               "distance": 5.0
            },
            {
               "title": "Rest or cross-training"
            },
            {
               "title": "General aerobic\n{6:10}",
               "distance": 6.0
            },
            {
               "title": "Endurance\n{10:16}",
               "distance": 10.0
            }
         ]
      },
      {
         "workouts": [
            {
               "title": "Rest or cross-training"
            },
            {
               "title": "General aerobic\n{7:11}",
               "distance": 7.0
            },
            {
               "title": "General aerobic\n{3:5}",
               "distance": 3.0
            },
            {
               "title": "General aerobic + speed {6} w/ 8 x 100 m strides\n{6:10}",
               "distance": 6.0
            },
            {
               "title": "Rest or cross-training"
            },
            {
               "title": "General aerobic\n{7:11}",
               "distance": 7.0
            },
            {
               "title": "Endurance\n{10:16}",
               "distance": 10.0
            }
         ]
      },
      {
         "workouts": [
            {
               "title": "Rest or cross-training"
            },
            {
               "title": "General aerobic\n{7:11}",
               "distance": 7.0
            },
            {
               "title": "General aerobic\n{3:5}",
               "distance": 3.0
            },
            {
               "title": "Lactate threshold\n{7:11}\n18 min tempo run",
               "distance": 7.0
            },
            {
               "title": "Rest or cross-training"
            },
            {
               "title": "General aerobic\n{8:13}",
               "distance": 8.0
            },
            {
               "title": "Endurance\n{11:18}",
               "distance": 11.0
            }
         ]
      },
      {
         "workouts": [
            {
               "title": "Rest or cross-training"
            },
            {
               "title": "General aerobic\n{7:11}",
               "distance": 7.0
            },
            {
               "title": "General aerobic\n{3:5}",
               "distance": 3.0
            },
            {
               "title": "General aerobic + speed {7} w/ 8 x 100 m strides\n{7:11}",
               "distance": 7.0
            },
            {
               "title": "Rest or cross-training"
            },
            {
               "title": "General aerobic\n{8:13}",
               "distance": 8.0
            },
            {
               "title": "Endurance\n{11:18}",
               "distance": 11.0
            }
         ]
      },
      {
         "workouts": [
            {
               "title": "Rest or cross-training"
            },
            {
               "title": "General aerobic\n{8:13}",
               "distance": 8.0
            },
            {
               "title": "General aerobic\n{4:6}",
               "distance": 4.0
            },
            {
               "title": "Lactate threshold\n{8:13}\n20 min tempo run",
               "distance": 7.0
            },
            {
               "title": "Rest or cross-training"
            },
            {
               "title": "General aerobic\n{8:13}",
               "distance": 8.0
            },
            {
               "title": "Endurance\n{11:18}",
               "distance": 11.0
            }
         ]
      },
      {
         "workouts": [
            {
               "title": "Rest or cross-training"
            },
            {
               "title": "General aerobic\n{9:14}",
               "distance": 9.0
            },
            {
               "title": "General aerobic\n{4:6}",
               "distance": 4.0
            },
            {
               "title": "General aerobic + speed {8} w/ 8 x 100 m strides\n{8:13}",
               "distance": 7.0
            },
            {
               "title": "Rest or cross-training"
            },
            {
               "title": "General aerobic\n{9:14}",
               "distance": 9.0
            },
            {
               "title": "Endurance\n{12:19}",
               "distance": 12.0
            }
         ]
      },
      {
         "workouts": [
            {
               "title": "Rest or cross-training"
            },
            {
               "title": "General aerobic\n{9:14}",
               "distance": 9.0
            },
            {
               "title": "General aerobic\n{4:6}",
               "distance": 4.0
            },
            {
               "title": "Lactate threshold\n{8:13}\n22 min tempo run",
               "distance": 8.0
            },
            {
               "title": "Rest or cross-training"
            },
            {
               "title": "General aerobic\n{9:14}",
               "distance": 9.0
            },
            {
               "title": "Endurance\n{12:19}",
               "distance": 12.0
            }
         ]
      },
      {
         "workouts": [
            {
               "title": "Rest or cross-training"
            },
            {
               "title": "General aerobic\n{10:16}",
               "distance": 10.0
            },
            {
               "title": "General aerobic\n{5:8}",
               "distance": 4.0
            },
            {
               "title": "General aerobic + speed {8} w/ 8 x 100 m strides\n{8:13}",
               "distance": 8.0
            },
            {
               "title": "Rest or cross-training"
            },
            {
               "title": "General aerobic\n{10:16}",
               "distance": 10.0
            },
            {
               "title": "Endurance\n{12:19}",
               "distance": 12.0
            }
         ]
      }
   ]
}