{
   "id": "pfitz_more_than_85_recovery_4th",
   "name": "Pfitzinger/Douglas: Marathon More Than 85 Miles per Week Recovery",
   "description": "\"More Than 85 Miles per Week Recovery: Training Block 5 - Recovery\" from \"Advanced Marathoning\" (fourth edition) by Pete Pfitzinger and Scott Douglas",
   "units": "mi",
   "source": "https://www.amazon.com/dp/1718237472/",
   "type": "Marathon",
   "schedule": [
      {
         "workouts": [
            {
               "title": "Rest or cross-train"
            },
            {
               "title": "Rest or cross-train"
            },
            {
               "title": "Recovery {4:6}",
               "distance": 4
            },
            {
               "title": "Rest or cross-train"
            },
            {
               "title": "Recovery {6:10}",
               "distance": 6
            },
            {
               "title": "Rest or cross-train"
            },
            {
               "title": "Recovery {8:13}",
               "distance": 8
            }
         ]
      },
      {
         "workouts": [
            {
               "title": "Rest or cross-train"
            },
            {
               "title": "Recovery {5:8}",
               "distance": 5
            },
            {
               "title": "Recovery {6:10}",
               "distance": 6
            },
            {
               "title": "Rest or cross-train"
            },
            {
               "title": "Recovery {7:11}",
               "distance": 7
            },
            {
               "title": "Recovery {5:8}",
               "distance": 5
            },
            {
               "title": "Gen-aerobic {10:16}",
               "distance": 10
            }
         ]
      },
      {
         "workouts": [
            {
               "title": "Rest or cross-train"
            },
            {
               "title": "Recovery {6:10}",
               "distance": 6
            },
            {
               "title": "Recovery {7:11}",
               "distance": 7
            },
            {
               "title": "Rest or cross-train"
            },
            {
               "title": "Gen-aerobic + speed {8:13} with 8 x 100 m strides",
               "distance": 8
            },
            {
               "title": "Recovery {6:10}",
               "distance": 6
            },
            {
               "title": "Med-long run {11:18}",
               "distance": 11
            }
         ]
      },
      {
         "workouts": [
            {
               "title": "Rest or cross-train"
            },
            {
               "title": "Gen-aerobic {8:13}",
               "distance": 8
            },
            {
               "title": "Gen-aerobic {10:16}",
               "distance": 10
            },
            {
               "title": "Rest or cross-train"
            },
            {
               "title": "Gen-aerobic + speed {9:14} with 8 x 100 m strides",
               "distance": 9
            },
            {
               "title": "Recovery {6:10}",
               "distance": 6
            },
            {
               "title": "Med-long {12:19}",
               "distance": 12
            }
         ]
      },
      {
         "workouts": [
            {
               "title": "Recovery {6:10}",
               "distance": 6
            },
            {
               "title": "Gen-aerobic {8:13}",
               "distance": 8
            },
            {
               "title": "Gen-aerobic + speed {10:16} with 10 x 100 m strides",
               "distance": 10
            },
            {
               "title": "Rest or cross-train"
            },
            {
               "title": "LT {10:16} with {4:6} at LT pace",
               "distance": 10
            },
            {
               "title": "Recovery {6:10}",
               "distance": 6
            },
            {
               "title": "Med-long {14:23}",
               "distance": 14
            }
         ]
      }
   ]
}