{
   "id": "pfitz_70_recovery_4th",
   "name": "Pfitzinger/Douglas: Marathon 55 to 70 Miles per Week Recovery",
   "description": "\"55 to 70 Miles per Week Recovery: Training Block 5 - Recovery\" from \"Advanced Marathoning\" (fourth edition) by Pete Pfitzinger and Scott Douglas",
   "units": "mi",
   "source": "https://www.amazon.com/dp/1718237472/",
   "type": "Marathon",
   "schedule": [
      {
         "workouts": [
            {
               "title": "Rest or cross-train",
               "distance": [
                  0.0,
                  0.0
               ]
            },
            {
               "title": "Rest or cross-train",
               "distance": [
                  0.0,
                  0.0
               ]
            },
            {
               "title": "Recovery {3-4:5-6}",
               "distance": [
                  3.0,
                  4.0
               ]
            },
            {
               "title": "Rest or cross-train",
               "distance": [
                  0.0,
                  0.0
               ]
            },
            {
               "title": "Recovery {4-5:6-8}",
               "distance": [
                  4.0,
                  5.0
               ]
            },
            {
               "title": "Rest or cross-train",
               "distance": [
                  0.0,
                  0.0
               ]
            },
            {
               "title": "Recovery {5-6:8-10}",
               "distance": [
                  5.0,
                  6.0
               ]
            }
         ]
      },
      {
         "workouts": [
            {
               "title": "Rest or cross-train",
               "distance": [
                  0.0,
                  0.0
               ]
            },
            {
               "title": "Recovery {4-5:6-8}",
               "distance": [
                  4.0,
                  5.0
               ]
            },
            {
               "title": "Recovery {4-6:6-10}",
               "distance": [
                  4.0,
                  6.0
               ]
            },
            {
               "title": "Rest or cross-train",
               "distance": [
                  0.0,
                  0.0
               ]
            },
            {
               "title": "Recovery {5-6:8-10}",
               "distance": [
                  5.0,
                  6.0
               ]
            },
            {
               "title": "Rest or cross-train",
               "distance": [
                  0.0,
                  0.0
               ]
            },
            {
               "title": "Gen-aerobic {7-8:11-13}",
               "distance": [
                  7.0,
                  8.0
               ]
            }
         ]
      },
      {
         "workouts": [
            {
               "title": "Rest or cross-train",
               "distance": [
                  0.0,
                  0.0
               ]
            },
            {
               "title": "Recovery {5-6:8-10}",
               "distance": [
                  5.0,
                  6.0
               ]
            },
            {
               "title": "Recovery {4-5:6-8}",
               "distance": [
                  4.0,
                  5.0
               ]
            },
            {
               "title": "Rest or cross-train",
               "distance": [
                  0.0,
                  0.0
               ]
            },
            {
               "title": "Gen-aerobic + speed {7-8:11-13} with 8 \u00d7 100 m strides",
               "distance": [
                  7.0,
                  8.0
               ]
            },
            {
               "title": "Recovery {4-5:6-8}",
               "distance": [
                  4.0,
                  5.0
               ]
            },
            {
               "title": "Gen-aerobic {8-9:13-14}",
               "distance": [
                  8.0,
                  9.0
               ]
            }
         ]
      },
      {
         "workouts": [
            {
               "title": "Rest or cross-train",
               "distance": [
                  0.0,
                  0.0
               ]
            },
            {
               "title": "Recovery {5-6:8-10}",
               "distance": [
                  5.0,
                  6.0
               ]
            },
            {
               "title": "Gen-aerobic {9-10:14-16}",
               "distance": [
                  9.0,
                  10.0
               ]
            },
            {
               "title": "Rest or cross-train",
               "distance": [
                  0.0,
                  0.0
               ]
            },
            {
               "title": "Gen-aerobic + speed {8-9:13-14} with 8 \u00d7 100 m strides",
               "distance": [
                  8.0,
                  9.0
               ]
            },
            {
               "title": "Recovery {4-5:6-8}",
               "distance": [
                  4.0,
                  5.0
               ]
            },
            {
               "title": "Med-long run {10-11:16-18}",
               "distance": [
                  10.0,
                  11.0
               ]
            }
         ]
      },
      {
         "workouts": [
            {
               "title": "Rest or cross-train",
               "distance": [
                  0.0,
                  0.0
               ]
            },
            {
               "title": "Recovery {6-7:10-11}",
               "distance": [
                  6.0,
                  7.0
               ]
            },
            {
               "title": "Gen-aerobic + speed {8-9:13-14} with 8 \u00d7 100 m strides",
               "distance": [
                  8.0,
                  9.0
               ]
            },
            {
               "title": "Rest or cross-train",
               "distance": [
                  0.0,
                  0.0
               ]
            },
            {
               "title": "Gen-aerobic + speed {8-9:13-14} with 8 \u00d7 100 m strides",
               "distance": [
                  8.0,
                  9.0
               ]
            },
            {
               "title": "Recovery {5-6:8-10}",
               "distance": [
                  5.0,
                  6.0
               ]
            },
            {
               "title": "Med-long run {11-13:18-21}",
               "distance": [
                  11.0,
                  13.0
               ]
            }
         ]
      }
   ]
}