{
   "id": "pfitz_06_multi_4th",
   "name": "Pfitzinger/Douglas: Multiple Marathoning, 6-week schedule",
   "description": "\"Multiple Marathoning, 6-week schedule\" from \"Advanced Marathoning\" (fourth edition) by Pete Pfitzinger and Scott Douglas",
   "units": "mi",
   "source": "https://www.amazon.com/dp/1718237472/",
   "type": "Marathon",
   "schedule": [
      {
         "workouts": [
            {
               "title": "Rest or cross-train"
            },
            {
               "title": "Rest or cross-train"
            },
            {
               "title": "Recovery {4-5:6-8}",
               "distance": [
                  4.0,
                  5.0
               ]
            },
            {
               "title": "Rest or cross-train"
            },
            {
               "title": "Recovery {5-6:8-10}",
               "distance": [
                  5.0,
                  6.0
               ]
            },
            {
               "title": "Recovery {4-5:6-8}",
               "distance": [
                  4.0,
                  5.0
               ]
            },
            {
               "title": "Recovery {6-7:10-11}",
               "distance": [
                  6.0,
                  7.0
               ]
            }
         ]
      },
      {
         "workouts": [
            {
               "title": "Rest or cross-train"
            },
            {
               "title": "Recovery {5-6:8-10}",
               "distance": [
                  5.0,
                  6.0
               ]
            },
            {
               "title": "Gen-aerobic {7-8:11-13}",
               "distance": [
                  7.0,
                  8.0
               ]
            },
            {
               "title": "Rest or cross-train"
            },
            {
               "title": "Gen-aerobic + speed {7-8:11-13} with 8 x 100 m strides",
               "distance": [
                  7.0,
                  8.0
               ]
            },
            {
               "title": "Recovery {5-6:8-10}",
               "distance": [
                  5.0,
                  6.0
               ]
            },
            {
               "title": "Gen-aerobic {9-10:14-16}",
               "distance": [
                  9.0,
                  10.0
               ]
            }
         ]
      },
      {
         "workouts": [
            {
               "title": "Rest or cross-train"
            },
            {
               "title": "Gen-aerobic + speed {7-8:11-13} with 8 x 100 m strides",
               "distance": [
                  7.0,
                  8.0
               ]
            },
            {
               "title": "Med-long run {11-12:18-19}",
               "distance": [
                  11.0,
                  12.0
               ]
            },
            {
               "title": "Recovery {4-5:6-8}",
               "distance": [
                  4.0,
                  5.0
               ]
            },
            {
               "title": "V\u0307O\u2082max {8-9:13-14} with 6 x 600 m at 5K race pace; jog 50%-90% interval time",
               "distance": [
                  8.0,
                  9.0
               ]
            },
            {
               "title": "Recovery {4-5:6-8}",
               "distance": [
                  4.0,
                  5.0
               ]
            },
            {
               "title": "Med-long run {13-14:21-23}",
               "distance": [
                  13.0,
                  14.0
               ]
            }
         ]
      },
      {
         "workouts": [
            {
               "title": "Rest or cross-train"
            },
            {
               "title": "V\u0307O\u2082max {8-9:13-14} with 6 x 600 m at 5K race pace; jog 50%-90% interval time",
               "distance": [
                  8.0,
                  9.0
               ]
            },
            {
               "title": "Gen-aerobic {9-10:14-16}",
               "distance": [
                  9.0,
                  10.0
               ]
            },
            {
               "title": "Recovery + speed {5-6:8-10} with 6 x 100 m strides",
               "distance": [
                  5.0,
                  6.0
               ]
            },
            {
               "title": "Recovery {4-5:6-8}",
               "distance": [
                  4.0,
                  5.0
               ]
            },
            {
               "title": "8K-10K tune-up race (total {10-12:16-19})",
               "distance": [
                  10.0,
                  12.0
               ]
            },
            {
               "title": "Long run {16-17:26-27}",
               "distance": [
                  16.0,
                  17.0
               ]
            }
         ]
      },
      {
         "workouts": [
            {
               "title": "Rest or cross-train"
            },
            {
               "title": "Recovery + speed {6-7:10-11} with 8 x 100 m strides",
               "distance": [
                  6.0,
                  7.0
               ]
            },
            {
               "title": "Recovery {4-5:6-8}",
               "distance": [
                  4.0,
                  5.0
               ]
            },
            {
               "title": "V\u0307O\u2082max {8-9:13-14} with 6 x 600 m at 5K race pace; jog 50%-90% interval time",
               "distance": [
                  8.0,
                  9.0
               ]
            },
            {
               "title": "Recovery {4-5:6-8}",
               "distance": [
                  4.0,
                  5.0
               ]
            },
            {
               "title": "Recovery + speed {6-7:10-11} with 8 x 100 m strides",
               "distance": [
                  6.0,
                  7.0
               ]
            },
            {
               "title": "Med-long run {12-13:19-21}",
               "distance": [
                  12.0,
                  13.0
               ]
            }
         ]
      },
      {
         "workouts": [
            {
               "title": "Rest"
            },
            {
               "title": "Recovery {5-6:8-10}",
               "distance": [
                  5.0,
                  6.0
               ]
            },
            {
               "title": "Dress rehearsal {6-7:10-11} with {2:3} at marathon pace",
               "distance": [
                  6.0,
                  7.0
               ]
            },
            {
               "title": "Recovery {4-5:6-8}",
               "distance": [
                  4.0,
                  5.0
               ]
            },
            {
               "title": "Recovery + speed {4-5:6-8} with 6 x 100 m strides",
               "distance": [
                  4.0,
                  5.0
               ]
            },
            {
               "title": "Recovery {2-4:3-6}",
               "distance": [
                  2.0,
                  4.0
               ]
            },
            {
               "title": "Second marathon",
               "distance": 26.2
            }
         ]
      }
   ]
}