{
   "id": "pfitz_08_multi",
   "name": "Pfitzinger/Douglas: Multiple Marathoning, 8-week schedule",
   "description": "\"Multiple Marathoning, 8-week schedule\" from \"Advanced Marathoning\" (third edition) by Pete Pfitzinger and Scott Douglas",
   "units": "mi",
   "source": "https://www.amazon.com/gp/product/149256866X/",
   "type": "Marathon",
   "schedule": [
      {
         "workouts": [
            {
               "title": "Rest or cross-train"
            },
            {
               "title": "Rest or cross-train"
            },
            {
               "title": "Recovery {5:8}",
               "distance": 5.0
            },
            {
               "title": "Rest or cross-train"
            },
            {
               "title": "Recovery {5:8}",
               "distance": 5.0
            },
            {
               "title": "Recovery {5:8}",
               "distance": 5.0
            },
            {
               "title": "Recovery {7:11}",
               "distance": 7.0
            }
         ]
      },
      {
         "workouts": [
            {
               "title": "Rest or cross-train"
            },
            {
               "title": "Recovery {5:8}",
               "distance": 5.0
            },
            {
               "title": "Recovery {5:8}",
               "distance": 5.0
            },
            {
               "title": "Rest or cross-train"
            },
            {
               "title": "Gen-aerobic + speed {7:11} with 8 x 100 m strides",
               "distance": 7.0
            },
            {
               "title": "Recovery {5:8}",
               "distance": 5.0
            },
            {
               "title": "Gen-aerobic {10:16}",
               "distance": 10.0
            }
         ]
      },
      {
         "workouts": [
            {
               "title": "Rest or cross-train"
            },
            {
               "title": "Recovery {6:10}",
               "distance": 6.0
            },
            {
               "title": "Gen-aerobic {9:14}",
               "distance": 9.0
            },
            {
               "title": "Rest or cross-train"
            },
            {
               "title": "Gen-aerobic + speed {9:14} with 8 x 100 m strides",
               "distance": 9.0
            },
            {
               "title": "Recovery {5:8}",
               "distance": 5.0
            },
            {
               "title": "Med-long run {13:21}",
               "distance": 13.0
            }
         ]
      },
      {
         "workouts": [
            {
               "title": "Rest or cross-train"
            },
            {
               "title": "Gen-aerobic + speed {8:13} with 6 x 10 sec hill sprints + 8 x 100 m strides",
               "distance": 8.0
            },
            {
               "title": "Med-long run {12:19}",
               "distance": 12.0
            },
            {
               "title": "Recovery {4:6}",
               "distance": 4.0
            },
            {
               "title": "LT {9:14} with {5:8} at LT pace",
               "distance": 9.0
            },
            {
               "title": "Recovery + speed {5:8} with 6 x 100 m strides",
               "distance": 5.0
            },
            {
               "title": "Long run {17:27}",
               "distance": 17.0
            }
         ]
      },
      {
         "workouts": [
            {
               "title": "Rest or cross-train"
            },
            {
               "title": "Recovery {6:10}",
               "distance": 6.0
            },
            {
               "title": "VO\u2082max {10:16} with 5 x 1,000 m at 5K race pace; jog 50-90% interval time",
               "distance": 10.0
            },
            {
               "title": "Med-long run {15:24}",
               "distance": 15.0
            },
            {
               "title": "Gen-aerobic {9:14}",
               "distance": 9.0
            },
            {
               "title": "Recovery {6:10}",
               "distance": 6.0
            },
            {
               "title": "Long run {20:32}",
               "distance": 20.0
            }
         ]
      },
      {
         "workouts": [
            {
               "title": "Rest or cross-train"
            },
            {
               "title": "VO\u2082max {9:14} with 6 x 600 m at 5K race pace; jog 50-90% interval time",
               "distance": 9.0
            },
            {
               "title": "Med-long run {11:18}",
               "distance": 11.0
            },
            {
               "title": "Recovery + speed {6:10} with 6 x 100 m strides",
               "distance": 6.0
            },
            {
               "title": "Recovery {5:8}",
               "distance": 5.0
            },
            {
               "title": "8K-10K tune-up race (total 9-11 miles [14-18 km])",
               "distance": 9.0
            },
            {
               "title": "Long run {17:27}",
               "distance": 17.0
            }
         ]
      },
      {
         "workouts": [
            {
               "title": "Rest or cross-train"
            },
            {
               "title": "Gen-aerobic + speed {8:13} with 8 x 100 m strides",
               "distance": 8.0
            },
            {
               "title": "Recovery {5:8}",
               "distance": 5.0
            },
            {
               "title": "VO\u2082max {9:14} with 4 x 1,200 m at 5K race pace; jog 50-90% interval time",
               "distance": 9.0
            },
            {
               "title": "Recovery {5:8}",
               "distance": 5.0
            },
            {
               "title": "Recovery + speed {6:10} with 8 x 100 m strides",
               "distance": 6.0
            },
            {
               "title": "Med-long run {13:21}",
               "distance": 13.0
            }
         ]
      },
      {
         "workouts": [
            {
               "title": "Rest"
            },
            {
               "title": "Recovery {6:10}",
               "distance": 6.0
            },
            {
               "title": "Dress rehearsal {7:11} with {2:3} at marathon pace",
               "distance": 7.0
            },
            {
               "title": "Recovery {6:10}",
               "distance": 6.0
            },
            {
               "title": "Recovery + speed {5:8} with 6 x 100 m strides",
               "distance": 5.0
            },
            {
               "title": "Recovery {4:6}",
               "distance": 4.0
            },
            {
               "title": "Second Marathon",
               "distance": 26.2
            }
         ]
      }
   ]
}